{
  "schema_version": "1.0.0",
  "record_type": "work",
  "id": "gls:work:9b18cc64-7d5e-4f30-b63d-a0ec30c1f7e1",
  "slug": "great-library-of-siso",
  "name": "The Great Library of SISO",
  "summary": "The public human-readable and agent-readable registry for SISO source.",
  "work_type": "library",
  "lifecycle_status": "active",
  "updated_at": "2026-09-05",
  "provenance": {
    "origin": "siso",
    "owners": [
      {
        "name": "SISO Open Source Foundation",
        "role": "steward",
        "classification": "siso"
      }
    ],
    "locators": [
      {
        "type": "source_repository",
        "url": "https://github.com/sisodias/great-library-of-siso",
        "revision": "main@2bd415dd3024c928fc8414b891e7f21069c3fcaa",
        "visibility": "public",
        "verified": true,
        "evidence": {
          "kind": "integration_check",
          "reference": "https://github.com/sisodias/great-library-of-siso",
          "observed_at": "2026-07-30",
          "summary": "Canonical public repository is pinned after the generated flagship repository header was added to the verified registry source."
        }
      },
      {
        "type": "homepage",
        "url": "https://great-library-of-siso.pages.dev/",
        "revision": "production",
        "visibility": "public",
        "verified": true,
        "evidence": {
          "kind": "integration_check",
          "reference": "https://great-library-of-siso.pages.dev/",
          "observed_at": "2026-09-05",
          "summary": "Cloudflare Pages production origin and representative Library routes returned HTTP 200 after the V38 deployment; Vercel alias retained one cycle as fallback per ADR-0006."
        }
      }
    ],
    "license": {
      "status": "verified",
      "spdx": "MIT",
      "reason": "The public registry source now carries an MIT license.",
      "evidence": [
        {
          "kind": "source_review",
          "reference": "https://github.com/sisodias/great-library-of-siso/blob/b9702f03cceb0226d0e62c984bd93930f924aae3/LICENSE",
          "observed_at": "2026-07-30",
          "summary": "MIT license is present at the pinned source commit."
        }
      ]
    }
  },
  "relationships": [],
  "evidence": [
    {
      "kind": "registry_validation",
      "reference": "registry:seed:v1",
      "observed_at": "2026-07-29",
      "summary": "Seed Work accepted by the V1 registry validator."
    },
    {
      "kind": "release_receipt",
      "reference": "repo-check:great-library-of-siso:2bd415dd3024c928fc8414b891e7f21069c3fcaa",
      "observed_at": "2026-07-30",
      "summary": "Registry schemas, generated site, repository header, link and identity checks, and publication scan passed."
    }
  ]
}
