{
  "schema_version": "1.0.0",
  "record_type": "work",
  "id": "gls:work:8acb11e9-026f-47e3-b620-bb1b969bcbcd",
  "slug": "siso-skills",
  "name": "SISO Skills",
  "summary": "The registry and distribution boundary for atomic repeatable capabilities, with evidence-backed classification, bundled installation, isolated skill telemetry, and independent repository promotion only when a skill earns its own lifecycle.",
  "work_type": "capability_pack",
  "lifecycle_status": "active",
  "updated_at": "2026-09-22",
  "provenance": {
    "origin": "siso",
    "owners": [
      {
        "name": "SISO Open Source Foundation",
        "role": "steward",
        "classification": "siso"
      }
    ],
    "locators": [
      {
        "type": "source_repository",
        "url": "https://github.com/sisodias/siso-skills-hub",
        "revision": "4c889b990055f667628486b033a83b77a199027a",
        "visibility": "public",
        "verified": true,
        "evidence": {
          "kind": "integration_check",
          "reference": "https://github.com/sisodias/siso-skills-hub/commit/4c889b990055f667628486b033a83b77a199027a",
          "observed_at": "2026-09-22",
          "summary": "Public canonical source includes the pinned independent Jev entry and reviewed snapshot."
        }
      }
    ],
    "license": {
      "status": "verified",
      "spdx": "MIT",
      "reason": "The SISO-owned Hub and bundled source carry MIT; promoted or external Skills retain their independently declared rights.",
      "evidence": [
        {
          "kind": "source_review",
          "reference": "https://github.com/sisodias/siso-skills-hub/blob/d82cd4468fc5f6017a0d8d9d3827bae441fd11db/PROVENANCE.md",
          "observed_at": "2026-07-30",
          "summary": "Repository provenance, bundled-source boundary, external-rights rule, task-state reconciliation, and publication cleanup are recorded at the pin."
        }
      ]
    }
  },
  "relationships": [
    {
      "type": "integrates_with",
      "target_work_id": "gls:work:b584bbf7-acde-46a2-b33e-e430ee1df224",
      "context": "Agent Runtime discovers and invokes atomic Skills, while the Skills catalog retains independent source identity and promotion decisions.",
      "evidence": [
        {
          "kind": "source_review",
          "reference": "source-review:siso-agent-base-modules:skills-runtime:2026-07-30",
          "observed_at": "2026-07-30",
          "summary": "Runtime consumption does not require shared repository ownership."
        }
      ]
    },
    {
      "type": "related_to",
      "target_work_id": "gls:work:083503ab-c78e-4e07-ac40-ab9466dcedcc",
      "context": "Entries that compose multiple capabilities or encode one workflow phase belong with Agent Playbook; the Hub retains atomic capability identity.",
      "evidence": [
        {
          "kind": "source_review",
          "reference": "registry:skills-promotion-assessments:2195cbb",
          "observed_at": "2026-07-30",
          "summary": "Ten of 28 current entries were directly classified as playbooks or playbook steps."
        }
      ]
    },
    {
      "type": "related_to",
      "target_work_id": "gls:work:5af5cab4-13d9-48c4-b15c-8c31ba3db10b",
      "context": "The legacy task/state family is reconciled: Task Manager is a thin Brain adapter, PM Tasks is a deprecated alias, and the mixed OS Database source is decomposed across owning Works.",
      "evidence": [
        {
          "kind": "source_review",
          "reference": "registry:skills-promotion-assessments:d82cd44",
          "observed_at": "2026-07-30",
          "summary": "Accepted decisions pin Agent Brain's exact importer release; the Hub keeps adapters and separate capability telemetry only."
        }
      ]
    }
  ],
  "evidence": [
    {
      "kind": "source_review",
      "reference": "source-review:siso-agent-base-decomposition:skills:2026-07-30",
      "observed_at": "2026-07-30",
      "summary": "Skills were classified as atomic capabilities consumed by the Agents operating stack; playbooks compose them for scenarios."
    },
    {
      "kind": "release_receipt",
      "reference": "repo-check:siso-skills-hub:d82cd4468fc5f6017a0d8d9d3827bae441fd11db",
      "observed_at": "2026-07-30",
      "summary": "All 28 entries validate; adapter routing, raw-SQL refusal, telemetry isolation/health reads, generated HTML, installation, and forbidden-coupling checks passed."
    },
    {
      "kind": "source_review",
      "reference": "https://github.com/sisodias/siso-skills-hub/blob/d82cd4468fc5f6017a0d8d9d3827bae441fd11db/registry/legacy-task-consumers.json",
      "observed_at": "2026-07-30",
      "summary": "Every in-repository legacy task consumer has an explicit migrated, transitional, preserved, or reclassified state."
    },
    {
      "kind": "release_receipt",
      "reference": "repo-check:siso-skills-hub:5e33b2b1e21dfd54e66d9223ece058e7727c2cf8",
      "observed_at": "2026-09-06",
      "summary": "Canonical Hub suite passes 33 skills; publish 0.1.1 passes public-input, symlink/alias destination, collision and aggregate-memory checks. Official copy installation matches all source files. The prior frozen publish revision remains in commit 7cf036a."
    },
    {
      "kind": "release_receipt",
      "reference": "https://github.com/sisodias/siso-skills-hub/pull/1",
      "observed_at": "2026-09-22",
      "summary": "Jev promotion merged into the public catalog. Full Hub check passed for 35 skills, including 51 Jev tests; a disposable installation matched all 21 public source files."
    }
  ]
}
