{
  "schema_version": "1.0.0",
  "record_type": "work",
  "id": "gls:work:b9196c61-901f-4105-93d9-899876d17016",
  "slug": "siso-agent-stack-distribution",
  "name": "SISO Agent Stack Distribution",
  "summary": "The one-clone, version-pinned public distribution for the SISO Claude Code and Codex environment, composing independently released skills, hooks, playbooks, agent roles, operating profiles, commands, runtimes, and optional services without merging their repository identities.",
  "work_type": "bundle",
  "lifecycle_status": "active",
  "updated_at": "2026-08-01",
  "provenance": {
    "origin": "siso",
    "owners": [{"name":"SISO Open Source Foundation","role":"steward","classification":"siso"}],
    "locators": [{
      "type": "source_repository",
      "url": "https://github.com/sisodias/siso-agent-stack",
      "revision": "main@f4a9626c0a1771cd3ee449f25a1ab63c8b297845",
      "visibility": "public",
      "verified": true,
      "evidence": {"kind":"integration_check","reference":"github:sisodias/siso-agent-stack:f4a9626c0a1771cd3ee449f25a1ab63c8b297845","observed_at":"2026-08-01","summary":"Public main matches the exact release checkpoint commit after clean public-source and full non-external installation checks."}
    }],
    "license": {
      "status": "verified",
      "spdx": "MIT",
      "reason": "The distribution source is MIT; each pinned component retains its independently declared license, including external Apache-2.0 Herdr source.",
      "evidence": [{"kind":"source_review","reference":"https://github.com/sisodias/siso-agent-stack/blob/f4a9626c0a1771cd3ee449f25a1ab63c8b297845/LICENSE","observed_at":"2026-08-01","summary":"The distribution license is present at the exact pin and the manifest records every component license."}]
    }
  },
  "relationships": [
    {"type":"depends_on","target_work_id":"gls:work:4198f323-9855-43f6-a99a-72143086818e","context":"The distribution delegates lifecycle configuration and verification to the independently released Hooks Work.","evidence":[{"kind":"integration_check","reference":"stack-manifest:hooks:9125a972b4ba03661bf17ee135790282f246c15f","observed_at":"2026-08-01","summary":"The hook component is required, commit-pinned, installed, and checked by stack doctor."}]},
    {"type":"depends_on","target_work_id":"gls:work:8acb11e9-026f-47e3-b620-bb1b969bcbcd","context":"The Skills Hub supplies the atomic capabilities linked into both host profiles.","evidence":[{"kind":"integration_check","reference":"stack-install:skills:32:2026-08-01","observed_at":"2026-08-01","summary":"Clean installs linked 32 discovered skills and doctor verified their exact sources."}]},
    {"type":"depends_on","target_work_id":"gls:work:083503ab-c78e-4e07-ac40-ab9466dcedcc","context":"The Playbook supplies scenario skills and worker commands while retaining its independent source and release cadence.","evidence":[{"kind":"source_review","reference":"https://github.com/sisodias/siso-agent-stack/blob/f4a9626c0a1771cd3ee449f25a1ab63c8b297845/stack.manifest.json","observed_at":"2026-08-01","summary":"Playbook is a required exact-pinned component rather than duplicated source."}]},
    {"type":"integrates_with","target_work_id":"gls:work:831c3bc6-36a0-4f88-93a8-55d3240849cc","context":"Herdr remains an optional external Apache-2.0 source component and independent upstream.","evidence":[{"kind":"source_review","reference":"stack-manifest:herdr:26a7bc860e4af516ef687d90b9f9dd2830f88d2a","observed_at":"2026-08-01","summary":"The manifest records Herdr as optional external source and does not claim SISO ownership."}]}
  ],
  "evidence": [
    {"kind":"release_receipt","reference":"https://github.com/sisodias/siso-agent-stack/blob/f4a9626c0a1771cd3ee449f25a1ab63c8b297845/reports/implementation-checkpoint.html","observed_at":"2026-08-01","summary":"The checkpoint records plan, implementation, Hooks review, and Stack review scores of 94, 96, 97, and 98 out of 100."},
    {"kind":"integration_check","reference":"clean-install:siso-agent-stack:0.1.0:2026-08-01","observed_at":"2026-08-01","summary":"A public required-only install cloned six repositories; a full non-external install pinned nine repositories, linked 32 skills, installed five host-native agent roles and 14 command shims, loaded Codex hooks, and passed doctor."}
  ]
}
